{
  "pixelsPerUnit": 67.477,
  "cellHeight": 256,
  "groundY": 25,
  "anchorX": "centre",
  "fps": 8,
  "directions": [
    "front",
    "front_right",
    "right",
    "back_right",
    "back",
    "back_left",
    "left",
    "front_left"
  ],
  "animations": {
    "attack_1": {
      "cellWidth": 224,
      "frames": 5,
      "actionFrame": 3
    },
    "attack_2": {
      "cellWidth": 232,
      "frames": 5,
      "actionFrame": 2
    },
    "cast_1": {
      "cellWidth": 176,
      "frames": 4
    },
    "death_1": {
      "cellWidth": 408,
      "frames": 9
    },
    "hit_1": {
      "cellWidth": 168,
      "frames": 2
    },
    "hit_2": {
      "cellWidth": 160,
      "frames": 2
    },
    "idle_1": {
      "cellWidth": 136,
      "frames": 8
    },
    "idle_2": {
      "cellWidth": 184,
      "frames": 18
    },
    "idle_3": {
      "cellWidth": 144,
      "frames": 14
    },
    "run": {
      "cellWidth": 208,
      "frames": 6
    },
    "talk_1": {
      "cellWidth": 112,
      "frames": 12
    },
    "walk": {
      "cellWidth": 168,
      "frames": 8
    }
  }
}